{
  "$schema": "http://json-schema.org/draft-07/schema#",
  "title": "News Comparative Analysis (Simplified)",
  "type": "object",
  "required": ["story_summary", "reader_guidance", "consensus", "key_differences"],
  "properties": {
    "story_summary": {
      "type": "string",
      "description": "Neutral summary of what happened in the story. Stick to the basic facts. 1-2 sentences maximum."
    },
    "reader_guidance": {
      "type": "string",
      "description": "Brief guidance helping readers understand the analysis results. 1-2 sentences."
    },
    "consensus": {
      "type": "object",
      "description": "Key-value pairs. The key is the agreed-upon fact, and the value is the list of sources confirming it. Max 4 facts.",
      "maxProperties": 4,
      "additionalProperties": {
        "type": "array",
        "items": {"type": "string"}
      }
    },
    "key_differences": {
      "type": "array",
      "description": "List of the most important differences (max 3), with each difference formatted as a single string.",
      "maxItems": 3,
      "items": {
        "type": "string",
        "description": "IMPORTANT: Use the exact format 'Aspect: [What differs] | Group A ([Source1, Source2]): [Their approach] | Group B ([Source3, Source4]): [Their approach]'"
      }
    }
  }
}